Title,Slug,Difficulty,Tags,Paid Only
Mean of Array After Removing Some Elements,mean-of-array-after-removing-some-elements,Easy,"Array, Sorting",FALSE
Coordinate With Maximum Network Quality,coordinate-with-maximum-network-quality,Medium,"Array, Enumeration",FALSE
Number of Sets of K Non-Overlapping Line Segments,number-of-sets-of-k-non-overlapping-line-segments,Medium,"Math, Dynamic Programming, Combinatorics",FALSE
Fancy Sequence,fancy-sequence,Hard,"Math, Design, Segment Tree",FALSE
Largest Substring Between Two Equal Characters,largest-substring-between-two-equal-characters,Easy,"Hash Table, String",FALSE
Lexicographically Smallest String After Applying Operations,lexicographically-smallest-string-after-applying-operations,Medium,"String, Depth-First Search, Breadth-First Search, Enumeration",FALSE
Best Team With No Conflicts,best-team-with-no-conflicts,Medium,"Array, Dynamic Programming, Sorting",FALSE
Graph Connectivity With Threshold,graph-connectivity-with-threshold,Hard,"Array, Math, Union Find, Number Theory",FALSE
Design an Expression Tree With Evaluate Function,design-an-expression-tree-with-evaluate-function,Medium,"Array, Math, Stack, Tree, Design, Binary Tree",TRUE
Slowest Key,slowest-key,Easy,"Array, String",FALSE
Arithmetic Subarrays,arithmetic-subarrays,Medium,"Array, Hash Table, Sorting",FALSE
Path With Minimum Effort,path-with-minimum-effort,Medium,"Array, Binary Search, Depth-First Search, Breadth-First Search, Union Find, Heap (Priority Queue), Matrix",FALSE
Rank Transform of a Matrix,rank-transform-of-a-matrix,Hard,"Array, Union Find, Graph, Topological Sort, Sorting, Matrix",FALSE
Add Two Polynomials Represented as Linked Lists,add-two-polynomials-represented-as-linked-lists,Medium,"Linked List, Math, Two Pointers",TRUE
Sort Array by Increasing Frequency,sort-array-by-increasing-frequency,Easy,"Array, Hash Table, Sorting",FALSE
Widest Vertical Area Between Two Points Containing No Points,widest-vertical-area-between-two-points-containing-no-points,Easy,"Array, Sorting",FALSE
Count Substrings That Differ by One Character,count-substrings-that-differ-by-one-character,Medium,"Hash Table, String, Dynamic Programming, Enumeration",FALSE
Number of Ways to Form a Target String Given a Dictionary,number-of-ways-to-form-a-target-string-given-a-dictionary,Hard,"Array, String, Dynamic Programming",FALSE
Check Array Formation Through Concatenation,check-array-formation-through-concatenation,Easy,"Array, Hash Table",FALSE
Count Sorted Vowel Strings,count-sorted-vowel-strings,Medium,"Math, Dynamic Programming, Combinatorics",FALSE
Furthest Building You Can Reach,furthest-building-you-can-reach,Medium,"Array, Greedy, Heap (Priority Queue)",FALSE
Kth Smallest Instructions,kth-smallest-instructions,Hard,"Array, Math, Dynamic Programming, Combinatorics",FALSE
Lowest Common Ancestor of a Binary Tree II,lowest-common-ancestor-of-a-binary-tree-ii,Medium,"Tree, Depth-First Search, Binary Tree",TRUE
Get Maximum in Generated Array,get-maximum-in-generated-array,Easy,"Array, Simulation",FALSE
Minimum Deletions to Make Character Frequencies Unique,minimum-deletions-to-make-character-frequencies-unique,Medium,"Hash Table, String, Greedy, Sorting",FALSE
Sell Diminishing-Valued Colored Balls,sell-diminishing-valued-colored-balls,Medium,"Array, Math, Binary Search, Greedy, Sorting, Heap (Priority Queue)",FALSE
Create Sorted Array through Instructions,create-sorted-array-through-instructions,Hard,"Array, Binary Search, Divide and Conquer, Binary Indexed Tree, Segment Tree, Merge Sort, Ordered Set",FALSE
Lowest Common Ancestor of a Binary Tree III,lowest-common-ancestor-of-a-binary-tree-iii,Medium,"Hash Table, Two Pointers, Tree, Binary Tree",TRUE
Defuse the Bomb,defuse-the-bomb,Easy,"Array, Sliding Window",FALSE
Minimum Deletions to Make String Balanced,minimum-deletions-to-make-string-balanced,Medium,"String, Dynamic Programming, Stack",FALSE
Minimum Jumps to Reach Home,minimum-jumps-to-reach-home,Medium,"Array, Dynamic Programming, Breadth-First Search",FALSE
Distribute Repeating Integers,distribute-repeating-integers,Hard,"Array, Dynamic Programming, Backtracking, Bit Manipulation, Bitmask",FALSE
Design an Ordered Stream,design-an-ordered-stream,Easy,"Array, Hash Table, Design, Data Stream",FALSE
Determine if Two Strings Are Close,determine-if-two-strings-are-close,Medium,"Hash Table, String, Sorting, Counting",FALSE
Minimum Operations to Reduce X to Zero,minimum-operations-to-reduce-x-to-zero,Medium,"Array, Hash Table, Binary Search, Sliding Window, Prefix Sum",FALSE
Maximize Grid Happiness,maximize-grid-happiness,Hard,"Dynamic Programming, Bit Manipulation, Memoization, Bitmask",FALSE
Correct a Binary Tree,correct-a-binary-tree,Medium,"Hash Table, Tree, Depth-First Search, Breadth-First Search, Binary Tree",TRUE
Check If Two String Arrays are Equivalent,check-if-two-string-arrays-are-equivalent,Easy,"Array, String",FALSE
Smallest String With A Given Numeric Value,smallest-string-with-a-given-numeric-value,Medium,"String, Greedy",FALSE
Ways to Make a Fair Array,ways-to-make-a-fair-array,Medium,"Array, Prefix Sum",FALSE
Minimum Initial Energy to Finish Tasks,minimum-initial-energy-to-finish-tasks,Hard,"Array, Greedy, Sorting",FALSE
Change the Root of a Binary Tree,change-the-root-of-a-binary-tree,Medium,"Tree, Depth-First Search, Binary Tree",TRUE
Maximum Repeating Substring,maximum-repeating-substring,Easy,"String, Dynamic Programming, String Matching",FALSE
Merge In Between Linked Lists,merge-in-between-linked-lists,Medium,Linked List,FALSE
Design Front Middle Back Queue,design-front-middle-back-queue,Medium,"Array, Linked List, Design, Queue, Data Stream",FALSE
Minimum Number of Removals to Make Mountain Array,minimum-number-of-removals-to-make-mountain-array,Hard,"Array, Binary Search, Dynamic Programming, Greedy",FALSE
Richest Customer Wealth,richest-customer-wealth,Easy,"Array, Matrix",FALSE
Find the Most Competitive Subsequence,find-the-most-competitive-subsequence,Medium,"Array, Stack, Greedy, Monotonic Stack",FALSE
Minimum Moves to Make Array Complementary,minimum-moves-to-make-array-complementary,Medium,"Array, Hash Table, Prefix Sum",FALSE
Minimize Deviation in Array,minimize-deviation-in-array,Hard,"Array, Greedy, Heap (Priority Queue), Ordered Set",FALSE
Lowest Common Ancestor of a Binary Tree IV,lowest-common-ancestor-of-a-binary-tree-iv,Medium,"Hash Table, Tree, Depth-First Search, Binary Tree",TRUE
Goal Parser Interpretation,goal-parser-interpretation,Easy,String,FALSE
Max Number of K-Sum Pairs,max-number-of-k-sum-pairs,Medium,"Array, Hash Table, Two Pointers, Sorting",FALSE
Concatenation of Consecutive Binary Numbers,concatenation-of-consecutive-binary-numbers,Medium,"Math, Bit Manipulation, Simulation",FALSE
Minimum Incompatibility,minimum-incompatibility,Hard,"Array, Dynamic Programming, Bit Manipulation, Bitmask",FALSE
Longest Palindromic Subsequence II,longest-palindromic-subsequence-ii,Medium,"String, Dynamic Programming",TRUE
Count the Number of Consistent Strings,count-the-number-of-consistent-strings,Easy,"Array, Hash Table, String, Bit Manipulation, Counting",FALSE
Sum of Absolute Differences in a Sorted Array,sum-of-absolute-differences-in-a-sorted-array,Medium,"Array, Math, Prefix Sum",FALSE
Stone Game VI,stone-game-vi,Medium,"Array, Math, Greedy, Sorting, Heap (Priority Queue), Game Theory",FALSE
Delivering Boxes from Storage to Ports,delivering-boxes-from-storage-to-ports,Hard,"Array, Dynamic Programming, Segment Tree, Queue, Heap (Priority Queue), Prefix Sum, Monotonic Queue",FALSE
Count of Matches in Tournament,count-of-matches-in-tournament,Easy,"Math, Simulation",FALSE
Partitioning Into Minimum Number Of Deci-Binary Numbers,partitioning-into-minimum-number-of-deci-binary-numbers,Medium,"String, Greedy",FALSE
Stone Game VII,stone-game-vii,Medium,"Array, Math, Dynamic Programming, Game Theory",FALSE
Maximum Height by Stacking Cuboids ,maximum-height-by-stacking-cuboids,Hard,"Array, Dynamic Programming, Sorting",FALSE
Count Ways to Distribute Candies,count-ways-to-distribute-candies,Hard,Dynamic Programming,TRUE
Reformat Phone Number,reformat-phone-number,Easy,String,FALSE
Maximum Erasure Value,maximum-erasure-value,Medium,"Array, Hash Table, Sliding Window",FALSE
Jump Game VI,jump-game-vi,Medium,"Array, Dynamic Programming, Queue, Heap (Priority Queue), Monotonic Queue",FALSE
Checking Existence of Edge Length Limited Paths,checking-existence-of-edge-length-limited-paths,Hard,"Array, Two Pointers, Union Find, Graph, Sorting",FALSE
Number of Distinct Substrings in a String,number-of-distinct-substrings-in-a-string,Medium,"String, Trie, Rolling Hash, Suffix Array, Hash Function",TRUE
Number of Students Unable to Eat Lunch,number-of-students-unable-to-eat-lunch,Easy,"Array, Stack, Queue, Simulation",FALSE
Average Waiting Time,average-waiting-time,Medium,"Array, Simulation",FALSE
Maximum Binary String After Change,maximum-binary-string-after-change,Medium,"String, Greedy",FALSE
Minimum Adjacent Swaps for K Consecutive Ones,minimum-adjacent-swaps-for-k-consecutive-ones,Hard,"Array, Greedy, Sliding Window, Prefix Sum",FALSE
Determine if String Halves Are Alike,determine-if-string-halves-are-alike,Easy,"String, Counting",FALSE
Maximum Number of Eaten Apples,maximum-number-of-eaten-apples,Medium,"Array, Greedy, Heap (Priority Queue)",FALSE
Where Will the Ball Fall,where-will-the-ball-fall,Medium,"Array, Matrix, Simulation",FALSE
Maximum XOR With an Element From Array,maximum-xor-with-an-element-from-array,Hard,"Array, Bit Manipulation, Trie",FALSE
Largest Subarray Length K,largest-subarray-length-k,Easy,"Array, Greedy",TRUE
Maximum Units on a Truck,maximum-units-on-a-truck,Easy,"Array, Greedy, Sorting",FALSE
Count Good Meals,count-good-meals,Medium,"Array, Hash Table",FALSE
Ways to Split Array Into Three Subarrays,ways-to-split-array-into-three-subarrays,Medium,"Array, Two Pointers, Binary Search, Prefix Sum",FALSE
Minimum Operations to Make a Subsequence,minimum-operations-to-make-a-subsequence,Hard,"Array, Hash Table, Binary Search, Greedy",FALSE
Sum Of Special Evenly-Spaced Elements In Array,sum-of-special-evenly-spaced-elements-in-array,Hard,"Array, Dynamic Programming",TRUE
Calculate Money in Leetcode Bank,calculate-money-in-leetcode-bank,Easy,Math,FALSE
Maximum Score From Removing Substrings,maximum-score-from-removing-substrings,Medium,"String, Stack, Greedy",FALSE
Construct the Lexicographically Largest Valid Sequence,construct-the-lexicographically-largest-valid-sequence,Medium,"Array, Backtracking",FALSE
Number Of Ways To Reconstruct A Tree,number-of-ways-to-reconstruct-a-tree,Hard,"Tree, Graph",FALSE
Decode XORed Array,decode-xored-array,Easy,"Array, Bit Manipulation",FALSE
Swapping Nodes in a Linked List,swapping-nodes-in-a-linked-list,Medium,"Linked List, Two Pointers",FALSE
Minimize Hamming Distance After Swap Operations,minimize-hamming-distance-after-swap-operations,Medium,"Array, Depth-First Search, Union Find",FALSE
Find Minimum Time to Finish All Jobs,find-minimum-time-to-finish-all-jobs,Hard,"Array, Dynamic Programming, Backtracking, Bit Manipulation, Bitmask",FALSE
Checking Existence of Edge Length Limited Paths II,checking-existence-of-edge-length-limited-paths-ii,Hard,"Union Find, Graph, Minimum Spanning Tree",TRUE
Number Of Rectangles That Can Form The Largest Square,number-of-rectangles-that-can-form-the-largest-square,Easy,Array,FALSE
Tuple with Same Product,tuple-with-same-product,Medium,"Array, Hash Table, Counting",FALSE
Largest Submatrix With Rearrangements,largest-submatrix-with-rearrangements,Medium,"Array, Greedy, Sorting, Matrix",FALSE
Cat and Mouse II,cat-and-mouse-ii,Hard,"Array, Math, Dynamic Programming, Graph, Topological Sort, Memoization, Matrix, Game Theory",FALSE
Shortest Path to Get Food,shortest-path-to-get-food,Medium,"Array, Breadth-First Search, Matrix",TRUE
Find the Highest Altitude,find-the-highest-altitude,Easy,"Array, Prefix Sum",FALSE
Minimum Number of People to Teach,minimum-number-of-people-to-teach,Medium,"Array, Hash Table, Greedy",FALSE
Decode XORed Permutation,decode-xored-permutation,Medium,"Array, Bit Manipulation",FALSE
Count Ways to Make Array With Product,count-ways-to-make-array-with-product,Hard,"Array, Math, Dynamic Programming, Combinatorics, Number Theory",FALSE
Latest Time by Replacing Hidden Digits,latest-time-by-replacing-hidden-digits,Easy,"String, Greedy",FALSE
Change Minimum Characters to Satisfy One of Three Conditions,change-minimum-characters-to-satisfy-one-of-three-conditions,Medium,"Hash Table, String, Counting, Prefix Sum",FALSE
Find Kth Largest XOR Coordinate Value,find-kth-largest-xor-coordinate-value,Medium,"Array, Divide and Conquer, Bit Manipulation, Sorting, Heap (Priority Queue), Matrix, Prefix Sum, Quickselect",FALSE
Building Boxes,building-boxes,Hard,"Math, Binary Search, Greedy",FALSE
Find Distance in a Binary Tree,find-distance-in-a-binary-tree,Medium,"Hash Table, Tree, Depth-First Search, Breadth-First Search, Binary Tree",TRUE
Maximum Number of Balls in a Box,maximum-number-of-balls-in-a-box,Easy,"Hash Table, Math, Counting",FALSE
Restore the Array From Adjacent Pairs,restore-the-array-from-adjacent-pairs,Medium,"Array, Hash Table, Depth-First Search",FALSE
Can You Eat Your Favorite Candy on Your Favorite Day?,can-you-eat-your-favorite-candy-on-your-favorite-day,Medium,"Array, Prefix Sum",FALSE
Palindrome Partitioning IV,palindrome-partitioning-iv,Hard,"String, Dynamic Programming",FALSE
Maximum Subarray Sum After One Operation,maximum-subarray-sum-after-one-operation,Medium,"Array, Dynamic Programming",TRUE
Sum of Unique Elements,sum-of-unique-elements,Easy,"Array, Hash Table, Counting",FALSE
Maximum Absolute Sum of Any Subarray,maximum-absolute-sum-of-any-subarray,Medium,"Array, Dynamic Programming",FALSE
Minimum Length of String After Deleting Similar Ends,minimum-length-of-string-after-deleting-similar-ends,Medium,"Two Pointers, String",FALSE
Maximum Number of Events That Can Be Attended II,maximum-number-of-events-that-can-be-attended-ii,Hard,"Array, Binary Search, Dynamic Programming, Sorting",FALSE
Check if Array Is Sorted and Rotated,check-if-array-is-sorted-and-rotated,Easy,Array,FALSE
Maximum Score From Removing Stones,maximum-score-from-removing-stones,Medium,"Math, Greedy, Heap (Priority Queue)",FALSE
Largest Merge Of Two Strings,largest-merge-of-two-strings,Medium,"Two Pointers, String, Greedy",FALSE
Closest Subsequence Sum,closest-subsequence-sum,Hard,"Array, Two Pointers, Dynamic Programming, Bit Manipulation, Sorting, Bitmask",FALSE
Design Most Recently Used Queue,design-most-recently-used-queue,Medium,"Array, Hash Table, Stack, Design, Binary Indexed Tree, Ordered Set",TRUE
Minimum Changes To Make Alternating Binary String,minimum-changes-to-make-alternating-binary-string,Easy,String,FALSE
Count Number of Homogenous Substrings,count-number-of-homogenous-substrings,Medium,"Math, String",FALSE
Minimum Limit of Balls in a Bag,minimum-limit-of-balls-in-a-bag,Medium,"Array, Binary Search",FALSE
Minimum Degree of a Connected Trio in a Graph,minimum-degree-of-a-connected-trio-in-a-graph,Hard,Graph,FALSE
Buildings With an Ocean View,buildings-with-an-ocean-view,Medium,"Array, Stack, Monotonic Stack",TRUE
Longest Nice Substring,longest-nice-substring,Easy,"Hash Table, String, Divide and Conquer, Bit Manipulation, Sliding Window",FALSE
Form Array by Concatenating Subarrays of Another Array,form-array-by-concatenating-subarrays-of-another-array,Medium,"Array, Two Pointers, Greedy, String Matching",FALSE
Map of Highest Peak,map-of-highest-peak,Medium,"Array, Breadth-First Search, Matrix",FALSE
Tree of Coprimes,tree-of-coprimes,Hard,"Array, Math, Tree, Depth-First Search, Number Theory",FALSE
Merge Strings Alternately,merge-strings-alternately,Easy,"Two Pointers, String",FALSE
Minimum Number of Operations to Move All Balls to Each Box,minimum-number-of-operations-to-move-all-balls-to-each-box,Medium,"Array, String, Prefix Sum",FALSE
Maximum Score from Performing Multiplication Operations,maximum-score-from-performing-multiplication-operations,Hard,"Array, Dynamic Programming",FALSE
Maximize Palindrome Length From Subsequences,maximize-palindrome-length-from-subsequences,Hard,"String, Dynamic Programming",FALSE
Sort Features by Popularity,sort-features-by-popularity,Medium,"Array, Hash Table, String, Sorting",TRUE
Count Items Matching a Rule,count-items-matching-a-rule,Easy,"Array, String",FALSE
Closest Dessert Cost,closest-dessert-cost,Medium,"Array, Dynamic Programming, Backtracking",FALSE
Equal Sum Arrays With Minimum Number of Operations,equal-sum-arrays-with-minimum-number-of-operations,Medium,"Array, Hash Table, Greedy, Counting",FALSE
Car Fleet II,car-fleet-ii,Hard,"Array, Math, Stack, Heap (Priority Queue), Monotonic Stack",FALSE
Shortest Path in a Hidden Grid,shortest-path-in-a-hidden-grid,Medium,"Array, Depth-First Search, Breadth-First Search, Matrix, Interactive",TRUE
Find Nearest Point That Has the Same X or Y Coordinate,find-nearest-point-that-has-the-same-x-or-y-coordinate,Easy,Array,FALSE
Check if Number is a Sum of Powers of Three,check-if-number-is-a-sum-of-powers-of-three,Medium,Math,FALSE
Sum of Beauty of All Substrings,sum-of-beauty-of-all-substrings,Medium,"Hash Table, String, Counting",FALSE
Count Pairs Of Nodes,count-pairs-of-nodes,Hard,"Array, Two Pointers, Binary Search, Graph, Sorting",FALSE
Check if Binary String Has at Most One Segment of Ones,check-if-binary-string-has-at-most-one-segment-of-ones,Easy,String,FALSE
Minimum Elements to Add to Form a Given Sum,minimum-elements-to-add-to-form-a-given-sum,Medium,"Array, Greedy",FALSE
Number of Restricted Paths From First to Last Node,number-of-restricted-paths-from-first-to-last-node,Medium,"Dynamic Programming, Graph, Topological Sort, Heap (Priority Queue), Shortest Path",FALSE
Make the XOR of All Segments Equal to Zero,make-the-xor-of-all-segments-equal-to-zero,Hard,"Array, Dynamic Programming, Bit Manipulation",FALSE
Maximize the Beauty of the Garden,maximize-the-beauty-of-the-garden,Hard,"Array, Hash Table, Greedy, Prefix Sum",TRUE
Check if One String Swap Can Make Strings Equal,check-if-one-string-swap-can-make-strings-equal,Easy,"Hash Table, String, Counting",FALSE
Find Center of Star Graph,find-center-of-star-graph,Easy,Graph,FALSE
Maximum Average Pass Ratio,maximum-average-pass-ratio,Medium,"Array, Greedy, Heap (Priority Queue)",FALSE
Maximum Score of a Good Subarray,maximum-score-of-a-good-subarray,Hard,"Array, Two Pointers, Binary Search, Stack, Monotonic Stack",FALSE
Count Pairs of Equal Substrings With Minimum Difference,count-pairs-of-equal-substrings-with-minimum-difference,Medium,"Hash Table, String, Greedy",TRUE
Second Largest Digit in a String,second-largest-digit-in-a-string,Easy,"Hash Table, String",FALSE
Design Authentication Manager,design-authentication-manager,Medium,"Hash Table, Linked List, Design, Doubly-Linked List",FALSE
Maximum Number of Consecutive Values You Can Make,maximum-number-of-consecutive-values-you-can-make,Medium,"Array, Greedy, Sorting",FALSE
Maximize Score After N Operations,maximize-score-after-n-operations,Hard,"Array, Math, Dynamic Programming, Backtracking, Bit Manipulation, Number Theory, Bitmask",FALSE
Maximum Ascending Subarray Sum,maximum-ascending-subarray-sum,Easy,Array,FALSE
Number of Orders in the Backlog,number-of-orders-in-the-backlog,Medium,"Array, Heap (Priority Queue), Simulation",FALSE
Maximum Value at a Given Index in a Bounded Array,maximum-value-at-a-given-index-in-a-bounded-array,Medium,"Binary Search, Greedy",FALSE
Count Pairs With XOR in a Range,count-pairs-with-xor-in-a-range,Hard,"Array, Bit Manipulation, Trie",FALSE
Implement Trie II (Prefix Tree),implement-trie-ii-prefix-tree,Medium,"Hash Table, String, Design, Trie",TRUE
Number of Different Integers in a String,number-of-different-integers-in-a-string,Easy,"Hash Table, String",FALSE
Minimum Number of Operations to Reinitialize a Permutation,minimum-number-of-operations-to-reinitialize-a-permutation,Medium,"Array, Math, Simulation",FALSE
Evaluate the Bracket Pairs of a String,evaluate-the-bracket-pairs-of-a-string,Medium,"Array, Hash Table, String",FALSE
Maximize Number of Nice Divisors,maximize-number-of-nice-divisors,Hard,"Math, Recursion, Number Theory",FALSE
Minimum Path Cost in a Hidden Grid,minimum-path-cost-in-a-hidden-grid,Medium,"Array, Depth-First Search, Breadth-First Search, Graph, Heap (Priority Queue), Matrix, Interactive, Shortest Path",TRUE
Determine Color of a Chessboard Square,determine-color-of-a-chessboard-square,Easy,"Math, String",FALSE
Sentence Similarity III,sentence-similarity-iii,Medium,"Array, Two Pointers, String",FALSE
Count Nice Pairs in an Array,count-nice-pairs-in-an-array,Medium,"Array, Hash Table, Math, Counting",FALSE
Maximum Number of Groups Getting Fresh Donuts,maximum-number-of-groups-getting-fresh-donuts,Hard,"Array, Dynamic Programming, Bit Manipulation, Memoization, Bitmask",FALSE
Truncate Sentence,truncate-sentence,Easy,"Array, String",FALSE
Finding the Users Active Minutes,finding-the-users-active-minutes,Medium,"Array, Hash Table",FALSE
Minimum Absolute Sum Difference,minimum-absolute-sum-difference,Medium,"Array, Binary Search, Sorting, Ordered Set",FALSE
Number of Different Subsequences GCDs,number-of-different-subsequences-gcds,Hard,"Array, Math, Counting, Number Theory",FALSE
Maximum Number of Accepted Invitations,maximum-number-of-accepted-invitations,Medium,"Array, Depth-First Search, Graph, Matrix",TRUE
Sign of the Product of an Array,sign-of-the-product-of-an-array,Easy,"Array, Math",FALSE
Find the Winner of the Circular Game,find-the-winner-of-the-circular-game,Medium,"Array, Math, Recursion, Queue, Simulation",FALSE
Minimum Sideway Jumps,minimum-sideway-jumps,Medium,"Array, Dynamic Programming, Greedy",FALSE
Finding MK Average,finding-mk-average,Hard,"Design, Queue, Heap (Priority Queue), Data Stream, Ordered Set",FALSE
Faulty Sensor,faulty-sensor,Easy,"Array, Two Pointers",TRUE
Minimum Operations to Make the Array Increasing,minimum-operations-to-make-the-array-increasing,Easy,"Array, Greedy",FALSE
Queries on Number of Points Inside a Circle,queries-on-number-of-points-inside-a-circle,Medium,"Array, Math, Geometry",FALSE
Maximum XOR for Each Query,maximum-xor-for-each-query,Medium,"Array, Bit Manipulation, Prefix Sum",FALSE
Minimum Number of Operations to Make String Sorted,minimum-number-of-operations-to-make-string-sorted,Hard,"Math, String, Combinatorics",FALSE
Check if the Sentence Is Pangram,check-if-the-sentence-is-pangram,Easy,"Hash Table, String",FALSE
Maximum Ice Cream Bars,maximum-ice-cream-bars,Medium,"Array, Greedy, Sorting, Counting Sort",FALSE
Single-Threaded CPU,single-threaded-cpu,Medium,"Array, Sorting, Heap (Priority Queue)",FALSE
Find XOR Sum of All Pairs Bitwise AND,find-xor-sum-of-all-pairs-bitwise-and,Hard,"Array, Math, Bit Manipulation",FALSE
Remove Duplicates From an Unsorted Linked List,remove-duplicates-from-an-unsorted-linked-list,Medium,"Hash Table, Linked List",TRUE
Sum of Digits in Base K,sum-of-digits-in-base-k,Easy,Math,FALSE
Frequency of the Most Frequent Element,frequency-of-the-most-frequent-element,Medium,"Array, Binary Search, Greedy, Sliding Window, Sorting, Prefix Sum",FALSE
Longest Substring Of All Vowels in Order,longest-substring-of-all-vowels-in-order,Medium,"String, Sliding Window",FALSE
Maximum Building Height,maximum-building-height,Hard,"Array, Math, Sorting",FALSE
Next Palindrome Using Same Digits,next-palindrome-using-same-digits,Hard,"Two Pointers, String",TRUE
Replace All Digits with Characters,replace-all-digits-with-characters,Easy,String,FALSE
Seat Reservation Manager,seat-reservation-manager,Medium,"Design, Heap (Priority Queue)",FALSE
Maximum Element After Decreasing and Rearranging,maximum-element-after-decreasing-and-rearranging,Medium,"Array, Greedy, Sorting",FALSE
Closest Room,closest-room,Hard,"Array, Binary Search, Sorting, Ordered Set",FALSE
Minimum Distance to the Target Element,minimum-distance-to-the-target-element,Easy,Array,FALSE
Splitting a String Into Descending Consecutive Values,splitting-a-string-into-descending-consecutive-values,Medium,"String, Backtracking",FALSE
Minimum Adjacent Swaps to Reach the Kth Smallest Number,minimum-adjacent-swaps-to-reach-the-kth-smallest-number,Medium,"Two Pointers, String, Greedy",FALSE
Minimum Interval to Include Each Query,minimum-interval-to-include-each-query,Hard,"Array, Binary Search, Line Sweep, Sorting, Heap (Priority Queue)",FALSE
Distinct Numbers in Each Subarray,distinct-numbers-in-each-subarray,Medium,"Array, Hash Table, Sliding Window",TRUE
Maximum Population Year,maximum-population-year,Easy,"Array, Counting, Prefix Sum",FALSE
Maximum Distance Between a Pair of Values,maximum-distance-between-a-pair-of-values,Medium,"Array, Two Pointers, Binary Search",FALSE
Maximum Subarray Min-Product,maximum-subarray-min-product,Medium,"Array, Stack, Monotonic Stack, Prefix Sum",FALSE
Largest Color Value in a Directed Graph,largest-color-value-in-a-directed-graph,Hard,"Hash Table, Dynamic Programming, Graph, Topological Sort, Memoization, Counting",FALSE
Longest Word With All Prefixes,longest-word-with-all-prefixes,Medium,"Depth-First Search, Trie",TRUE
Sorting the Sentence,sorting-the-sentence,Easy,"String, Sorting",FALSE
Incremental Memory Leak,incremental-memory-leak,Medium,"Math, Simulation",FALSE
Rotating the Box,rotating-the-box,Medium,"Array, Two Pointers, Matrix",FALSE
Sum of Floored Pairs,sum-of-floored-pairs,Hard,"Array, Math, Binary Search, Prefix Sum",FALSE
Sum of All Subset XOR Totals,sum-of-all-subset-xor-totals,Easy,"Array, Math, Backtracking, Bit Manipulation, Combinatorics, Enumeration",FALSE
Minimum Number of Swaps to Make the Binary String Alternating,minimum-number-of-swaps-to-make-the-binary-string-alternating,Medium,"String, Greedy",FALSE
Finding Pairs With a Certain Sum,finding-pairs-with-a-certain-sum,Medium,"Array, Hash Table, Design",FALSE
