Title,Slug,Difficulty,Tags,Paid Only
Backspace String Compare,backspace-string-compare,Easy,"Two Pointers, String, Stack, Simulation",FALSE
Longest Mountain in Array,longest-mountain-in-array,Medium,"Array, Two Pointers, Dynamic Programming, Enumeration",FALSE
Hand of Straights,hand-of-straights,Medium,"Array, Hash Table, Greedy, Sorting",FALSE
Shortest Path Visiting All Nodes,shortest-path-visiting-all-nodes,Hard,"Dynamic Programming, Bit Manipulation, Breadth-First Search, Graph, Bitmask",FALSE
Shifting Letters,shifting-letters,Medium,"Array, String, Prefix Sum",FALSE
Maximize Distance to Closest Person,maximize-distance-to-closest-person,Medium,Array,FALSE
Rectangle Area II,rectangle-area-ii,Hard,"Array, Segment Tree, Line Sweep, Ordered Set",FALSE
Loud and Rich,loud-and-rich,Medium,"Array, Depth-First Search, Graph, Topological Sort",FALSE
Peak Index in a Mountain Array,peak-index-in-a-mountain-array,Medium,"Array, Binary Search",FALSE
Car Fleet,car-fleet,Medium,"Array, Stack, Sorting, Monotonic Stack",FALSE
K-Similar Strings,k-similar-strings,Hard,"String, Breadth-First Search",FALSE
Exam Room,exam-room,Medium,"Design, Heap (Priority Queue), Ordered Set",FALSE
Score of Parentheses,score-of-parentheses,Medium,"String, Stack",FALSE
Minimum Cost to Hire K Workers,minimum-cost-to-hire-k-workers,Hard,"Array, Greedy, Sorting, Heap (Priority Queue)",FALSE
Mirror Reflection,mirror-reflection,Medium,"Math, Geometry, Number Theory",FALSE
Buddy Strings,buddy-strings,Easy,"Hash Table, String",FALSE
Lemonade Change,lemonade-change,Easy,"Array, Greedy",FALSE
Score After Flipping Matrix,score-after-flipping-matrix,Medium,"Array, Greedy, Bit Manipulation, Matrix",FALSE
Shortest Subarray with Sum at Least K,shortest-subarray-with-sum-at-least-k,Hard,"Array, Binary Search, Queue, Sliding Window, Heap (Priority Queue), Prefix Sum, Monotonic Queue",FALSE
All Nodes Distance K in Binary Tree,all-nodes-distance-k-in-binary-tree,Medium,"Hash Table, Tree, Depth-First Search, Breadth-First Search, Binary Tree",FALSE
Shortest Path to Get All Keys,shortest-path-to-get-all-keys,Hard,"Array, Bit Manipulation, Breadth-First Search, Matrix",FALSE
Smallest Subtree with all the Deepest Nodes,smallest-subtree-with-all-the-deepest-nodes,Medium,"Hash Table, Tree, Depth-First Search, Breadth-First Search, Binary Tree",FALSE
Prime Palindrome,prime-palindrome,Medium,"Math, Number Theory",FALSE
Transpose Matrix,transpose-matrix,Easy,"Array, Matrix, Simulation",FALSE
Binary Gap,binary-gap,Easy,Bit Manipulation,FALSE
Reordered Power of 2,reordered-power-of-2,Medium,"Hash Table, Math, Sorting, Counting, Enumeration",FALSE
Advantage Shuffle,advantage-shuffle,Medium,"Array, Two Pointers, Greedy, Sorting",FALSE
Minimum Number of Refueling Stops,minimum-number-of-refueling-stops,Hard,"Array, Dynamic Programming, Greedy, Heap (Priority Queue)",FALSE
Leaf-Similar Trees,leaf-similar-trees,Easy,"Tree, Depth-First Search, Binary Tree",FALSE
Length of Longest Fibonacci Subsequence,length-of-longest-fibonacci-subsequence,Medium,"Array, Hash Table, Dynamic Programming",FALSE
Walking Robot Simulation,walking-robot-simulation,Medium,"Array, Hash Table, Simulation",FALSE
Koko Eating Bananas,koko-eating-bananas,Medium,"Array, Binary Search",FALSE
Middle of the Linked List,middle-of-the-linked-list,Easy,"Linked List, Two Pointers",FALSE
Stone Game,stone-game,Medium,"Array, Math, Dynamic Programming, Game Theory",FALSE
Nth Magical Number,nth-magical-number,Hard,"Math, Binary Search",FALSE
Profitable Schemes,profitable-schemes,Hard,"Array, Dynamic Programming",FALSE
Decoded String at Index,decoded-string-at-index,Medium,"String, Stack",FALSE
Boats to Save People,boats-to-save-people,Medium,"Array, Two Pointers, Greedy, Sorting",FALSE
Reachable Nodes In Subdivided Graph,reachable-nodes-in-subdivided-graph,Hard,"Graph, Heap (Priority Queue), Shortest Path",FALSE
Projection Area of 3D Shapes,projection-area-of-3d-shapes,Easy,"Array, Math, Geometry, Matrix",FALSE
Uncommon Words from Two Sentences,uncommon-words-from-two-sentences,Easy,"Hash Table, String, Counting",FALSE
Spiral Matrix III,spiral-matrix-iii,Medium,"Array, Matrix, Simulation",FALSE
Possible Bipartition,possible-bipartition,Medium,"Depth-First Search, Breadth-First Search, Union Find, Graph",FALSE
Super Egg Drop,super-egg-drop,Hard,"Math, Binary Search, Dynamic Programming",FALSE
Fair Candy Swap,fair-candy-swap,Easy,"Array, Hash Table, Binary Search, Sorting",FALSE
Construct Binary Tree from Preorder and Postorder Traversal,construct-binary-tree-from-preorder-and-postorder-traversal,Medium,"Array, Hash Table, Divide and Conquer, Tree, Binary Tree",FALSE
Find and Replace Pattern,find-and-replace-pattern,Medium,"Array, Hash Table, String",FALSE
Sum of Subsequence Widths,sum-of-subsequence-widths,Hard,"Array, Math, Sorting",FALSE
Surface Area of 3D Shapes,surface-area-of-3d-shapes,Easy,"Array, Math, Geometry, Matrix",FALSE
Groups of Special-Equivalent Strings,groups-of-special-equivalent-strings,Medium,"Array, Hash Table, String, Sorting",FALSE
All Possible Full Binary Trees,all-possible-full-binary-trees,Medium,"Dynamic Programming, Tree, Recursion, Memoization, Binary Tree",FALSE
Maximum Frequency Stack,maximum-frequency-stack,Hard,"Hash Table, Stack, Design, Ordered Set",FALSE
Monotonic Array,monotonic-array,Easy,Array,FALSE
Increasing Order Search Tree,increasing-order-search-tree,Easy,"Stack, Tree, Depth-First Search, Binary Search Tree, Binary Tree",FALSE
Bitwise ORs of Subarrays,bitwise-ors-of-subarrays,Medium,"Array, Dynamic Programming, Bit Manipulation",FALSE
Orderly Queue,orderly-queue,Hard,"Math, String, Sorting",FALSE
RLE Iterator,rle-iterator,Medium,"Array, Design, Counting, Iterator",FALSE
Online Stock Span,online-stock-span,Medium,"Stack, Design, Monotonic Stack, Data Stream",FALSE
Numbers At Most N Given Digit Set,numbers-at-most-n-given-digit-set,Hard,"Array, Math, String, Binary Search, Dynamic Programming",FALSE
Valid Permutations for DI Sequence,valid-permutations-for-di-sequence,Hard,"String, Dynamic Programming, Prefix Sum",FALSE
Fruit Into Baskets,fruit-into-baskets,Medium,"Array, Hash Table, Sliding Window",FALSE
Sort Array By Parity,sort-array-by-parity,Easy,"Array, Two Pointers, Sorting",FALSE
Super Palindromes,super-palindromes,Hard,"Math, String, Enumeration",FALSE
Sum of Subarray Minimums,sum-of-subarray-minimums,Medium,"Array, Dynamic Programming, Stack, Monotonic Stack",FALSE
Smallest Range I,smallest-range-i,Easy,"Array, Math",FALSE
Snakes and Ladders,snakes-and-ladders,Medium,"Array, Breadth-First Search, Matrix",FALSE
Smallest Range II,smallest-range-ii,Medium,"Array, Math, Greedy, Sorting",FALSE
Online Election,online-election,Medium,"Array, Hash Table, Binary Search, Design",FALSE
Sort an Array,sort-an-array,Medium,"Array, Divide and Conquer, Sorting, Heap (Priority Queue), Merge Sort, Bucket Sort, Radix Sort, Counting Sort",FALSE
Cat and Mouse,cat-and-mouse,Hard,"Math, Dynamic Programming, Graph, Topological Sort, Memoization, Game Theory",FALSE
X of a Kind in a Deck of Cards,x-of-a-kind-in-a-deck-of-cards,Easy,"Array, Hash Table, Math, Counting, Number Theory",FALSE
Partition Array into Disjoint Intervals,partition-array-into-disjoint-intervals,Medium,Array,FALSE
Word Subsets,word-subsets,Medium,"Array, Hash Table, String",FALSE
Reverse Only Letters,reverse-only-letters,Easy,"Two Pointers, String",FALSE
Maximum Sum Circular Subarray,maximum-sum-circular-subarray,Medium,"Array, Divide and Conquer, Dynamic Programming, Queue, Monotonic Queue",FALSE
Complete Binary Tree Inserter,complete-binary-tree-inserter,Medium,"Tree, Breadth-First Search, Design, Binary Tree",FALSE
Number of Music Playlists,number-of-music-playlists,Hard,"Math, Dynamic Programming, Combinatorics",FALSE
Minimum Add to Make Parentheses Valid,minimum-add-to-make-parentheses-valid,Medium,"String, Stack, Greedy",FALSE
Sort Array By Parity II,sort-array-by-parity-ii,Easy,"Array, Two Pointers, Sorting",FALSE
3Sum With Multiplicity,3sum-with-multiplicity,Medium,"Array, Hash Table, Two Pointers, Sorting, Counting",FALSE
Minimize Malware Spread,minimize-malware-spread,Hard,"Array, Hash Table, Depth-First Search, Breadth-First Search, Union Find, Graph",FALSE
Long Pressed Name,long-pressed-name,Easy,"Two Pointers, String",FALSE
Flip String to Monotone Increasing,flip-string-to-monotone-increasing,Medium,"String, Dynamic Programming",FALSE
Three Equal Parts,three-equal-parts,Hard,"Array, Math",FALSE
Minimize Malware Spread II,minimize-malware-spread-ii,Hard,"Array, Hash Table, Depth-First Search, Breadth-First Search, Union Find, Graph",FALSE
Unique Email Addresses,unique-email-addresses,Easy,"Array, Hash Table, String",FALSE
Binary Subarrays With Sum,binary-subarrays-with-sum,Medium,"Array, Hash Table, Sliding Window, Prefix Sum",FALSE
Minimum Falling Path Sum,minimum-falling-path-sum,Medium,"Array, Dynamic Programming, Matrix",FALSE
Beautiful Array,beautiful-array,Medium,"Array, Math, Divide and Conquer",FALSE
Number of Recent Calls,number-of-recent-calls,Easy,"Design, Queue, Data Stream",FALSE
Shortest Bridge,shortest-bridge,Medium,"Array, Depth-First Search, Breadth-First Search, Matrix",FALSE
Knight Dialer,knight-dialer,Medium,Dynamic Programming,FALSE
Stamping The Sequence,stamping-the-sequence,Hard,"String, Stack, Greedy, Queue",FALSE
Reorder Data in Log Files,reorder-data-in-log-files,Medium,"Array, String, Sorting",FALSE
Range Sum of BST,range-sum-of-bst,Easy,"Tree, Depth-First Search, Binary Search Tree, Binary Tree",FALSE
Minimum Area Rectangle,minimum-area-rectangle,Medium,"Array, Hash Table, Math, Geometry, Sorting",FALSE
Distinct Subsequences II,distinct-subsequences-ii,Hard,"String, Dynamic Programming",FALSE
Valid Mountain Array,valid-mountain-array,Easy,Array,FALSE
DI String Match,di-string-match,Easy,"Array, Two Pointers, String, Greedy",FALSE
Find the Shortest Superstring,find-the-shortest-superstring,Hard,"Array, String, Dynamic Programming, Bit Manipulation, Bitmask",FALSE
Delete Columns to Make Sorted,delete-columns-to-make-sorted,Easy,"Array, String",FALSE
Minimum Increment to Make Array Unique,minimum-increment-to-make-array-unique,Medium,"Array, Greedy, Sorting, Counting",FALSE
Validate Stack Sequences,validate-stack-sequences,Medium,"Array, Stack, Simulation",FALSE
Most Stones Removed with Same Row or Column,most-stones-removed-with-same-row-or-column,Medium,"Hash Table, Depth-First Search, Union Find, Graph",FALSE
Bag of Tokens,bag-of-tokens,Medium,"Array, Two Pointers, Greedy, Sorting",FALSE
Largest Time for Given Digits,largest-time-for-given-digits,Medium,"Array, String, Backtracking, Enumeration",FALSE
Reveal Cards In Increasing Order,reveal-cards-in-increasing-order,Medium,"Array, Queue, Sorting, Simulation",FALSE
Flip Equivalent Binary Trees,flip-equivalent-binary-trees,Medium,"Tree, Depth-First Search, Binary Tree",FALSE
Largest Component Size by Common Factor,largest-component-size-by-common-factor,Hard,"Array, Hash Table, Math, Union Find, Number Theory",FALSE
Verifying an Alien Dictionary,verifying-an-alien-dictionary,Easy,"Array, Hash Table, String",FALSE
Array of Doubled Pairs,array-of-doubled-pairs,Medium,"Array, Hash Table, Greedy, Sorting",FALSE
Delete Columns to Make Sorted II,delete-columns-to-make-sorted-ii,Medium,"Array, String, Greedy",FALSE
Tallest Billboard,tallest-billboard,Hard,"Array, Dynamic Programming",FALSE
Prison Cells After N Days,prison-cells-after-n-days,Medium,"Array, Hash Table, Math, Bit Manipulation",FALSE
Check Completeness of a Binary Tree,check-completeness-of-a-binary-tree,Medium,"Tree, Breadth-First Search, Binary Tree",FALSE
Regions Cut By Slashes,regions-cut-by-slashes,Medium,"Array, Hash Table, Depth-First Search, Breadth-First Search, Union Find, Matrix",FALSE
Delete Columns to Make Sorted III,delete-columns-to-make-sorted-iii,Hard,"Array, String, Dynamic Programming",FALSE
N-Repeated Element in Size 2N Array,n-repeated-element-in-size-2n-array,Easy,"Array, Hash Table",FALSE
Maximum Width Ramp,maximum-width-ramp,Medium,"Array, Two Pointers, Stack, Monotonic Stack",FALSE
Minimum Area Rectangle II,minimum-area-rectangle-ii,Medium,"Array, Math, Geometry",FALSE
Least Operators to Express Number,least-operators-to-express-number,Hard,"Math, Dynamic Programming, Memoization",FALSE
Univalued Binary Tree,univalued-binary-tree,Easy,"Tree, Depth-First Search, Breadth-First Search, Binary Tree",FALSE
Vowel Spellchecker,vowel-spellchecker,Medium,"Array, Hash Table, String",FALSE
Numbers With Same Consecutive Differences,numbers-with-same-consecutive-differences,Medium,"Backtracking, Breadth-First Search",FALSE
Binary Tree Cameras,binary-tree-cameras,Hard,"Dynamic Programming, Tree, Depth-First Search, Binary Tree",FALSE
Pancake Sorting,pancake-sorting,Medium,"Array, Two Pointers, Greedy, Sorting",FALSE
Powerful Integers,powerful-integers,Medium,"Hash Table, Math, Enumeration",FALSE
Flip Binary Tree To Match Preorder Traversal,flip-binary-tree-to-match-preorder-traversal,Medium,"Tree, Depth-First Search, Binary Tree",FALSE
Equal Rational Numbers,equal-rational-numbers,Hard,"Math, String",FALSE
K Closest Points to Origin,k-closest-points-to-origin,Medium,"Array, Math, Divide and Conquer, Geometry, Sorting, Heap (Priority Queue), Quickselect",FALSE
Subarray Sums Divisible by K,subarray-sums-divisible-by-k,Medium,"Array, Hash Table, Prefix Sum",FALSE
Odd Even Jump,odd-even-jump,Hard,"Array, Dynamic Programming, Stack, Monotonic Stack, Ordered Set",FALSE
Largest Perimeter Triangle,largest-perimeter-triangle,Easy,"Array, Math, Greedy, Sorting",FALSE
Squares of a Sorted Array,squares-of-a-sorted-array,Easy,"Array, Two Pointers, Sorting",FALSE
Longest Turbulent Subarray,longest-turbulent-subarray,Medium,"Array, Dynamic Programming, Sliding Window",FALSE
Distribute Coins in Binary Tree,distribute-coins-in-binary-tree,Medium,"Tree, Depth-First Search, Binary Tree",FALSE
Unique Paths III,unique-paths-iii,Hard,"Array, Backtracking, Bit Manipulation, Matrix",FALSE
Time Based Key-Value Store,time-based-key-value-store,Medium,"Hash Table, String, Binary Search, Design",FALSE
Triples with Bitwise AND Equal To Zero,triples-with-bitwise-and-equal-to-zero,Hard,"Array, Hash Table, Bit Manipulation",FALSE
Minimum Cost For Tickets,minimum-cost-for-tickets,Medium,"Array, Dynamic Programming",FALSE
String Without AAA or BBB,string-without-aaa-or-bbb,Medium,"String, Greedy",FALSE
Sum of Even Numbers After Queries,sum-of-even-numbers-after-queries,Medium,"Array, Simulation",FALSE
Interval List Intersections,interval-list-intersections,Medium,"Array, Two Pointers, Line Sweep",FALSE
Vertical Order Traversal of a Binary Tree,vertical-order-traversal-of-a-binary-tree,Hard,"Hash Table, Tree, Depth-First Search, Breadth-First Search, Sorting, Binary Tree",FALSE
Smallest String Starting From Leaf,smallest-string-starting-from-leaf,Medium,"String, Backtracking, Tree, Depth-First Search, Binary Tree",FALSE
Add to Array-Form of Integer,add-to-array-form-of-integer,Easy,"Array, Math",FALSE
Satisfiability of Equality Equations,satisfiability-of-equality-equations,Medium,"Array, String, Union Find, Graph",FALSE
Broken Calculator,broken-calculator,Medium,"Math, Greedy",FALSE
Subarrays with K Different Integers,subarrays-with-k-different-integers,Hard,"Array, Hash Table, Sliding Window, Counting",FALSE
Cousins in Binary Tree,cousins-in-binary-tree,Easy,"Tree, Depth-First Search, Breadth-First Search, Binary Tree",FALSE
Rotting Oranges,rotting-oranges,Medium,"Array, Breadth-First Search, Matrix",FALSE
Minimum Number of K Consecutive Bit Flips,minimum-number-of-k-consecutive-bit-flips,Hard,"Array, Bit Manipulation, Queue, Sliding Window, Prefix Sum",FALSE
Number of Squareful Arrays,number-of-squareful-arrays,Hard,"Array, Hash Table, Math, Dynamic Programming, Backtracking, Bit Manipulation, Bitmask",FALSE
Find the Town Judge,find-the-town-judge,Easy,"Array, Hash Table, Graph",FALSE
Maximum Binary Tree II,maximum-binary-tree-ii,Medium,"Tree, Binary Tree",FALSE
Available Captures for Rook,available-captures-for-rook,Easy,"Array, Matrix, Simulation",FALSE
Minimum Cost to Merge Stones,minimum-cost-to-merge-stones,Hard,"Array, Dynamic Programming, Prefix Sum",FALSE
Grid Illumination,grid-illumination,Hard,"Array, Hash Table",FALSE
Find Common Characters,find-common-characters,Easy,"Array, Hash Table, String",FALSE
Check If Word Is Valid After Substitutions,check-if-word-is-valid-after-substitutions,Medium,"String, Stack",FALSE
Max Consecutive Ones III,max-consecutive-ones-iii,Medium,"Array, Binary Search, Sliding Window, Prefix Sum",FALSE
Maximize Sum Of Array After K Negations,maximize-sum-of-array-after-k-negations,Easy,"Array, Greedy, Sorting",FALSE
Clumsy Factorial,clumsy-factorial,Medium,"Math, Stack, Simulation",FALSE
Minimum Domino Rotations For Equal Row,minimum-domino-rotations-for-equal-row,Medium,"Array, Greedy",FALSE
Construct Binary Search Tree from Preorder Traversal,construct-binary-search-tree-from-preorder-traversal,Medium,"Array, Stack, Tree, Binary Search Tree, Monotonic Stack, Binary Tree",FALSE
Complement of Base 10 Integer,complement-of-base-10-integer,Easy,Bit Manipulation,FALSE
Pairs of Songs With Total Durations Divisible by 60,pairs-of-songs-with-total-durations-divisible-by-60,Medium,"Array, Hash Table, Counting",FALSE
Capacity To Ship Packages Within D Days,capacity-to-ship-packages-within-d-days,Medium,"Array, Binary Search",FALSE
Numbers With Repeated Digits,numbers-with-repeated-digits,Hard,"Math, Dynamic Programming",FALSE
Partition Array Into Three Parts With Equal Sum,partition-array-into-three-parts-with-equal-sum,Easy,"Array, Greedy",FALSE
Best Sightseeing Pair,best-sightseeing-pair,Medium,"Array, Dynamic Programming",FALSE
Smallest Integer Divisible by K,smallest-integer-divisible-by-k,Medium,"Hash Table, Math",FALSE
Binary String With Substrings Representing 1 To N,binary-string-with-substrings-representing-1-to-n,Medium,String,FALSE
Convert to Base -2,convert-to-base-2,Medium,Math,FALSE
Binary Prefix Divisible By 5,binary-prefix-divisible-by-5,Easy,"Array, Bit Manipulation",FALSE
Next Greater Node In Linked List,next-greater-node-in-linked-list,Medium,"Array, Linked List, Stack, Monotonic Stack",FALSE
Number of Enclaves,number-of-enclaves,Medium,"Array, Depth-First Search, Breadth-First Search, Union Find, Matrix",FALSE
Remove Outermost Parentheses,remove-outermost-parentheses,Easy,"String, Stack",FALSE
Sum of Root To Leaf Binary Numbers,sum-of-root-to-leaf-binary-numbers,Easy,"Tree, Depth-First Search, Binary Tree",FALSE
Camelcase Matching,camelcase-matching,Medium,"Array, Two Pointers, String, Trie, String Matching",FALSE
Video Stitching,video-stitching,Medium,"Array, Dynamic Programming, Greedy",FALSE
Divisor Game,divisor-game,Easy,"Math, Dynamic Programming, Brainteaser, Game Theory",FALSE
Maximum Difference Between Node and Ancestor,maximum-difference-between-node-and-ancestor,Medium,"Tree, Depth-First Search, Binary Tree",FALSE
Longest Arithmetic Subsequence,longest-arithmetic-subsequence,Medium,"Array, Hash Table, Binary Search, Dynamic Programming",FALSE
Recover a Tree From Preorder Traversal,recover-a-tree-from-preorder-traversal,Hard,"String, Tree, Depth-First Search, Binary Tree",FALSE
Two City Scheduling,two-city-scheduling,Medium,"Array, Greedy, Sorting",FALSE
Matrix Cells in Distance Order,matrix-cells-in-distance-order,Easy,"Array, Math, Geometry, Sorting, Matrix",FALSE
Maximum Sum of Two Non-Overlapping Subarrays,maximum-sum-of-two-non-overlapping-subarrays,Medium,"Array, Dynamic Programming, Sliding Window",FALSE
Stream of Characters,stream-of-characters,Hard,"Array, String, Design, Trie, Data Stream",FALSE
Moving Stones Until Consecutive,moving-stones-until-consecutive,Medium,"Math, Brainteaser",FALSE
Coloring A Border,coloring-a-border,Medium,"Array, Depth-First Search, Breadth-First Search, Matrix",FALSE
Uncrossed Lines,uncrossed-lines,Medium,"Array, Dynamic Programming",FALSE
Escape a Large Maze,escape-a-large-maze,Hard,"Array, Hash Table, Depth-First Search, Breadth-First Search",FALSE
Valid Boomerang,valid-boomerang,Easy,"Array, Math, Geometry",FALSE
Binary Search Tree to Greater Sum Tree,binary-search-tree-to-greater-sum-tree,Medium,"Tree, Depth-First Search, Binary Search Tree, Binary Tree",FALSE
Minimum Score Triangulation of Polygon,minimum-score-triangulation-of-polygon,Medium,"Array, Dynamic Programming",FALSE
Moving Stones Until Consecutive II,moving-stones-until-consecutive-ii,Medium,"Array, Math, Two Pointers, Sorting",FALSE
Robot Bounded In Circle,robot-bounded-in-circle,Medium,"Math, String, Simulation",FALSE
Flower Planting With No Adjacent,flower-planting-with-no-adjacent,Medium,"Depth-First Search, Breadth-First Search, Graph",FALSE
Partition Array for Maximum Sum,partition-array-for-maximum-sum,Medium,"Array, Dynamic Programming",FALSE
Longest Duplicate Substring,longest-duplicate-substring,Hard,"String, Binary Search, Sliding Window, Rolling Hash, Suffix Array, Hash Function",FALSE
Last Stone Weight,last-stone-weight,Easy,"Array, Heap (Priority Queue)",FALSE
Remove All Adjacent Duplicates In String,remove-all-adjacent-duplicates-in-string,Easy,"String, Stack",FALSE
Longest String Chain,longest-string-chain,Medium,"Array, Hash Table, Two Pointers, String, Dynamic Programming, Sorting",FALSE
Last Stone Weight II,last-stone-weight-ii,Medium,"Array, Dynamic Programming",FALSE
Height Checker,height-checker,Easy,"Array, Sorting, Counting Sort",FALSE
Grumpy Bookstore Owner,grumpy-bookstore-owner,Medium,"Array, Sliding Window",FALSE
Previous Permutation With One Swap,previous-permutation-with-one-swap,Medium,"Array, Greedy",FALSE
Distant Barcodes,distant-barcodes,Medium,"Array, Hash Table, Greedy, Sorting, Heap (Priority Queue), Counting",FALSE
Shortest Way to Form String,shortest-way-to-form-string,Medium,"Two Pointers, String, Binary Search, Greedy",TRUE
Confusing Number,confusing-number,Easy,Math,TRUE
Campus Bikes,campus-bikes,Medium,"Array, Sorting, Heap (Priority Queue)",TRUE
Minimize Rounding Error to Meet Target,minimize-rounding-error-to-meet-target,Medium,"Array, Math, String, Greedy, Sorting",TRUE
All Paths from Source Lead to Destination,all-paths-from-source-lead-to-destination,Medium,"Graph, Topological Sort",TRUE
Missing Element in Sorted Array,missing-element-in-sorted-array,Medium,"Array, Binary Search",TRUE
Lexicographically Smallest Equivalent String,lexicographically-smallest-equivalent-string,Medium,"String, Union Find",FALSE
Longest Repeating Substring,longest-repeating-substring,Medium,"String, Binary Search, Dynamic Programming, Rolling Hash, Suffix Array, Hash Function",TRUE
Number of Valid Subarrays,number-of-valid-subarrays,Hard,"Array, Stack, Monotonic Stack",TRUE
Fixed Point,fixed-point,Easy,"Array, Binary Search",TRUE
Index Pairs of a String,index-pairs-of-a-string,Easy,"Array, String, Trie, Sorting",TRUE
Campus Bikes II,campus-bikes-ii,Medium,"Array, Dynamic Programming, Backtracking, Bit Manipulation, Bitmask",TRUE
Digit Count in Range,digit-count-in-range,Hard,"Math, Dynamic Programming",TRUE
Greatest Common Divisor of Strings,greatest-common-divisor-of-strings,Easy,"Math, String",FALSE
Flip Columns For Maximum Number of Equal Rows,flip-columns-for-maximum-number-of-equal-rows,Medium,"Array, Hash Table, Matrix",FALSE
Adding Two Negabinary Numbers,adding-two-negabinary-numbers,Medium,"Array, Math",FALSE
Number of Submatrices That Sum to Target,number-of-submatrices-that-sum-to-target,Hard,"Array, Hash Table, Matrix, Prefix Sum",FALSE
Occurrences After Bigram,occurrences-after-bigram,Easy,String,FALSE
Letter Tile Possibilities,letter-tile-possibilities,Medium,"Hash Table, String, Backtracking, Counting",FALSE
Insufficient Nodes in Root to Leaf Paths,insufficient-nodes-in-root-to-leaf-paths,Medium,"Tree, Depth-First Search, Binary Tree",FALSE
Smallest Subsequence of Distinct Characters,smallest-subsequence-of-distinct-characters,Medium,"String, Stack, Greedy, Monotonic Stack",FALSE
Sum of Digits in the Minimum Number,sum-of-digits-in-the-minimum-number,Easy,"Array, Math",TRUE
High Five,high-five,Easy,"Array, Hash Table, Sorting, Heap (Priority Queue)",TRUE
Brace Expansion,brace-expansion,Medium,"String, Backtracking, Breadth-First Search",TRUE
Confusing Number II,confusing-number-ii,Hard,"Math, Backtracking",TRUE
Duplicate Zeros,duplicate-zeros,Easy,"Array, Two Pointers",FALSE
Largest Values From Labels,largest-values-from-labels,Medium,"Array, Hash Table, Greedy, Sorting, Counting",FALSE
Shortest Path in Binary Matrix,shortest-path-in-binary-matrix,Medium,"Array, Breadth-First Search, Matrix",FALSE
Shortest Common Supersequence ,shortest-common-supersequence,Hard,"String, Dynamic Programming",FALSE
Statistics from a Large Sample,statistics-from-a-large-sample,Medium,"Array, Math, Probability and Statistics",FALSE
Car Pooling,car-pooling,Medium,"Array, Sorting, Heap (Priority Queue), Simulation, Prefix Sum",FALSE
Find in Mountain Array,find-in-mountain-array,Hard,"Array, Binary Search, Interactive",FALSE
Brace Expansion II,brace-expansion-ii,Hard,"String, Backtracking, Stack, Breadth-First Search",FALSE
Two Sum Less Than K,two-sum-less-than-k,Easy,"Array, Two Pointers, Binary Search, Sorting",TRUE
Find K-Length Substrings With No Repeated Characters,find-k-length-substrings-with-no-repeated-characters,Medium,"Hash Table, String, Sliding Window",TRUE
The Earliest Moment When Everyone Become Friends,the-earliest-moment-when-everyone-become-friends,Medium,"Array, Union Find, Sorting",TRUE
Path With Maximum Minimum Value,path-with-maximum-minimum-value,Medium,"Array, Binary Search, Depth-First Search, Breadth-First Search, Union Find, Heap (Priority Queue), Matrix",TRUE
Distribute Candies to People,distribute-candies-to-people,Easy,"Math, Simulation",FALSE
Path In Zigzag Labelled Binary Tree,path-in-zigzag-labelled-binary-tree,Medium,"Math, Tree, Binary Tree",FALSE
Filling Bookcase Shelves,filling-bookcase-shelves,Medium,"Array, Dynamic Programming",FALSE
