Title,Slug,Difficulty,Tags,Paid Only
Maximum Number of Integers to Choose From a Range II,maximum-number-of-integers-to-choose-from-a-range-ii,Medium,"Array, Binary Search, Greedy, Sorting",TRUE
Take Gifts From the Richest Pile,take-gifts-from-the-richest-pile,Easy,"Array, Heap (Priority Queue), Simulation",FALSE
Count Vowel Strings in Ranges,count-vowel-strings-in-ranges,Medium,"Array, String, Prefix Sum",FALSE
House Robber IV,house-robber-iv,Medium,"Array, Binary Search",FALSE
Rearranging Fruits,rearranging-fruits,Hard,"Array, Hash Table, Greedy",FALSE
Find the Array Concatenation Value,find-the-array-concatenation-value,Easy,"Array, Two Pointers, Simulation",FALSE
Count the Number of Fair Pairs,count-the-number-of-fair-pairs,Medium,"Array, Two Pointers, Binary Search, Sorting",FALSE
Substring XOR Queries,substring-xor-queries,Medium,"Array, Hash Table, String, Bit Manipulation",FALSE
Subsequence With the Minimum Score,subsequence-with-the-minimum-score,Hard,"Two Pointers, String, Binary Search",FALSE
Maximum Difference by Remapping a Digit,maximum-difference-by-remapping-a-digit,Easy,"Math, Greedy",FALSE
Minimum Score by Changing Two Elements,minimum-score-by-changing-two-elements,Medium,"Array, Greedy, Sorting",FALSE
Minimum Impossible OR,minimum-impossible-or,Medium,"Array, Bit Manipulation, Brainteaser",FALSE
Handling Sum Queries After Update,handling-sum-queries-after-update,Hard,"Array, Segment Tree",FALSE
Merge Two 2D Arrays by Summing Values,merge-two-2d-arrays-by-summing-values,Easy,"Array, Hash Table, Two Pointers",FALSE
Minimum Operations to Reduce an Integer to 0,minimum-operations-to-reduce-an-integer-to-0,Medium,"Dynamic Programming, Greedy, Bit Manipulation",FALSE
Count the Number of Square-Free Subsets,count-the-number-of-square-free-subsets,Medium,"Array, Math, Dynamic Programming, Bit Manipulation, Bitmask",FALSE
Find the String with LCP,find-the-string-with-lcp,Hard,"Array, String, Dynamic Programming, Greedy, Union Find, Matrix",FALSE
Left and Right Sum Differences,left-and-right-sum-differences,Easy,"Array, Prefix Sum",FALSE
Find the Divisibility Array of a String,find-the-divisibility-array-of-a-string,Medium,"Array, Math, String",FALSE
Find the Maximum Number of Marked Indices,find-the-maximum-number-of-marked-indices,Medium,"Array, Two Pointers, Binary Search, Greedy, Sorting",FALSE
Minimum Time to Visit a Cell In a Grid,minimum-time-to-visit-a-cell-in-a-grid,Hard,"Array, Breadth-First Search, Graph, Heap (Priority Queue), Matrix, Shortest Path",FALSE
Split With Minimum Sum,split-with-minimum-sum,Easy,"Math, Greedy, Sorting",FALSE
Count Total Number of Colored Cells,count-total-number-of-colored-cells,Medium,Math,FALSE
Count Ways to Group Overlapping Ranges,count-ways-to-group-overlapping-ranges,Medium,"Array, Sorting",FALSE
Count Number of Possible Root Nodes,count-number-of-possible-root-nodes,Hard,"Array, Hash Table, Dynamic Programming, Tree, Depth-First Search",FALSE
Pass the Pillow,pass-the-pillow,Easy,"Math, Simulation",FALSE
Kth Largest Sum in a Binary Tree,kth-largest-sum-in-a-binary-tree,Medium,"Tree, Breadth-First Search, Sorting, Binary Tree",FALSE
Split the Array to Make Coprime Products,split-the-array-to-make-coprime-products,Hard,"Array, Hash Table, Math, Number Theory",FALSE
Number of Ways to Earn Points,number-of-ways-to-earn-points,Hard,"Array, Dynamic Programming",FALSE
Count the Number of Vowel Strings in Range,count-the-number-of-vowel-strings-in-range,Easy,"Array, String, Counting",FALSE
Rearrange Array to Maximize Prefix Score,rearrange-array-to-maximize-prefix-score,Medium,"Array, Greedy, Sorting, Prefix Sum",FALSE
Count the Number of Beautiful Subarrays,count-the-number-of-beautiful-subarrays,Medium,"Array, Hash Table, Bit Manipulation, Prefix Sum",FALSE
Minimum Time to Complete All Tasks,minimum-time-to-complete-all-tasks,Hard,"Array, Binary Search, Stack, Greedy, Sorting",FALSE
Design a Todo List,design-a-todo-list,Medium,"Array, Hash Table, String, Design, Sorting",TRUE
Distribute Money to Maximum Children,distribute-money-to-maximum-children,Easy,"Math, Greedy",FALSE
Maximize Greatness of an Array,maximize-greatness-of-an-array,Medium,"Array, Two Pointers, Greedy, Sorting",FALSE
Find Score of an Array After Marking All Elements,find-score-of-an-array-after-marking-all-elements,Medium,"Array, Hash Table, Sorting, Heap (Priority Queue), Simulation",FALSE
Minimum Time to Repair Cars,minimum-time-to-repair-cars,Medium,"Array, Binary Search",FALSE
Number of Even and Odd Bits,number-of-even-and-odd-bits,Easy,Bit Manipulation,FALSE
Check Knight Tour Configuration,check-knight-tour-configuration,Medium,"Array, Depth-First Search, Breadth-First Search, Matrix, Simulation",FALSE
The Number of Beautiful Subsets,the-number-of-beautiful-subsets,Medium,"Array, Hash Table, Math, Dynamic Programming, Backtracking, Sorting, Combinatorics",FALSE
Smallest Missing Non-negative Integer After Operations,smallest-missing-non-negative-integer-after-operations,Medium,"Array, Hash Table, Math, Greedy",FALSE
Make the Prefix Sum Non-negative,make-the-prefix-sum-non-negative,Medium,"Array, Greedy, Heap (Priority Queue)",TRUE
K Items With the Maximum Sum,k-items-with-the-maximum-sum,Easy,"Math, Greedy",FALSE
Prime Subtraction Operation,prime-subtraction-operation,Medium,"Array, Math, Binary Search, Greedy, Number Theory",FALSE
Minimum Operations to Make All Array Elements Equal,minimum-operations-to-make-all-array-elements-equal,Medium,"Array, Binary Search, Sorting, Prefix Sum",FALSE
Collect Coins in a Tree,collect-coins-in-a-tree,Hard,"Array, Tree, Graph, Topological Sort",FALSE
Minimum Time to Eat All Grains,minimum-time-to-eat-all-grains,Hard,"Array, Two Pointers, Binary Search, Sorting",TRUE
Form Smallest Number From Two Digit Arrays,form-smallest-number-from-two-digit-arrays,Easy,"Array, Hash Table, Enumeration",FALSE
Find the Substring With Maximum Cost,find-the-substring-with-maximum-cost,Medium,"Array, Hash Table, String, Dynamic Programming",FALSE
Make K-Subarray Sums Equal,make-k-subarray-sums-equal,Medium,"Array, Math, Greedy, Sorting, Number Theory",FALSE
Shortest Cycle in a Graph,shortest-cycle-in-a-graph,Hard,"Breadth-First Search, Graph",FALSE
Find the Longest Balanced Substring of a Binary String,find-the-longest-balanced-substring-of-a-binary-string,Easy,String,FALSE
Convert an Array Into a 2D Array With Conditions,convert-an-array-into-a-2d-array-with-conditions,Medium,"Array, Hash Table",FALSE
Mice and Cheese,mice-and-cheese,Medium,"Array, Greedy, Sorting, Heap (Priority Queue)",FALSE
Minimum Reverse Operations,minimum-reverse-operations,Hard,"Array, Breadth-First Search, Ordered Set",FALSE
Beautiful Pairs,beautiful-pairs,Hard,"Array, Math, Divide and Conquer, Geometry, Sorting, Ordered Set",TRUE
Prime In Diagonal,prime-in-diagonal,Easy,"Array, Math, Matrix, Number Theory",FALSE
Sum of Distances,sum-of-distances,Medium,"Array, Hash Table, Prefix Sum",FALSE
Minimize the Maximum Difference of Pairs,minimize-the-maximum-difference-of-pairs,Medium,"Array, Binary Search, Greedy",FALSE
Minimum Number of Visited Cells in a Grid,minimum-number-of-visited-cells-in-a-grid,Hard,"Array, Dynamic Programming, Stack, Breadth-First Search, Union Find, Heap (Priority Queue), Matrix, Monotonic Stack",FALSE
Count the Number of K-Free Subsets,count-the-number-of-k-free-subsets,Medium,"Array, Math, Dynamic Programming, Sorting, Combinatorics",TRUE
Find the Width of Columns of a Grid,find-the-width-of-columns-of-a-grid,Easy,"Array, Matrix",FALSE
Find the Score of All Prefixes of an Array,find-the-score-of-all-prefixes-of-an-array,Medium,"Array, Prefix Sum",FALSE
Cousins in Binary Tree II,cousins-in-binary-tree-ii,Medium,"Hash Table, Tree, Depth-First Search, Breadth-First Search, Binary Tree",FALSE
Design Graph With Shortest Path Calculator,design-graph-with-shortest-path-calculator,Hard,"Graph, Design, Heap (Priority Queue), Shortest Path",FALSE
Row With Maximum Ones,row-with-maximum-ones,Easy,"Array, Matrix",FALSE
Find the Maximum Divisibility Score,find-the-maximum-divisibility-score,Easy,Array,FALSE
Minimum Additions to Make Valid String,minimum-additions-to-make-valid-string,Medium,"String, Dynamic Programming, Stack, Greedy",FALSE
Minimize the Total Price of the Trips,minimize-the-total-price-of-the-trips,Hard,"Array, Dynamic Programming, Tree, Depth-First Search, Graph",FALSE
Color the Triangle Red,color-the-triangle-red,Hard,"Array, Math",TRUE
Calculate Delayed Arrival Time,calculate-delayed-arrival-time,Easy,Math,FALSE
Sum Multiples,sum-multiples,Easy,Math,FALSE
Sliding Subarray Beauty,sliding-subarray-beauty,Medium,"Array, Hash Table, Sliding Window",FALSE
Minimum Number of Operations to Make All Array Elements Equal to 1,minimum-number-of-operations-to-make-all-array-elements-equal-to-1,Medium,"Array, Math, Number Theory",FALSE
Find Maximal Uncovered Ranges,find-maximal-uncovered-ranges,Medium,"Array, Sorting",TRUE
Maximum Sum With Exactly K Elements ,maximum-sum-with-exactly-k-elements,Easy,"Array, Greedy",FALSE
Find the Prefix Common Array of Two Arrays,find-the-prefix-common-array-of-two-arrays,Medium,"Array, Hash Table, Bit Manipulation",FALSE
Maximum Number of Fish in a Grid,maximum-number-of-fish-in-a-grid,Medium,"Array, Depth-First Search, Breadth-First Search, Union Find, Matrix",FALSE
Make Array Empty,make-array-empty,Hard,"Array, Binary Search, Greedy, Binary Indexed Tree, Segment Tree, Sorting, Ordered Set",FALSE
Determine the Winner of a Bowling Game,determine-the-winner-of-a-bowling-game,Easy,"Array, Simulation",FALSE
First Completely Painted Row or Column,first-completely-painted-row-or-column,Medium,"Array, Hash Table, Matrix",FALSE
Minimum Cost of a Path With Special Roads,minimum-cost-of-a-path-with-special-roads,Medium,"Array, Graph, Heap (Priority Queue), Shortest Path",FALSE
Lexicographically Smallest Beautiful String,lexicographically-smallest-beautiful-string,Hard,"String, Greedy",FALSE
The Knights Tour,the-knights-tour,Medium,"Array, Backtracking, Matrix",TRUE
Find the Distinct Difference Array,find-the-distinct-difference-array,Easy,"Array, Hash Table",FALSE
Frequency Tracker,frequency-tracker,Medium,"Hash Table, Design",FALSE
Number of Adjacent Elements With the Same Color,number-of-adjacent-elements-with-the-same-color,Medium,Array,FALSE
Make Costs of Paths Equal in a Binary Tree,make-costs-of-paths-equal-in-a-binary-tree,Medium,"Array, Dynamic Programming, Greedy, Tree, Binary Tree",FALSE
Split a Circular Linked List,split-a-circular-linked-list,Medium,"Linked List, Two Pointers",TRUE
Number of Senior Citizens,number-of-senior-citizens,Easy,"Array, String",FALSE
Sum in a Matrix,sum-in-a-matrix,Medium,"Array, Sorting, Heap (Priority Queue), Matrix, Simulation",FALSE
Maximum OR,maximum-or,Medium,"Array, Greedy, Bit Manipulation, Prefix Sum",FALSE
Power of Heroes,power-of-heroes,Hard,"Array, Math, Dynamic Programming, Sorting, Prefix Sum",FALSE
Find the Losers of the Circular Game,find-the-losers-of-the-circular-game,Easy,"Array, Hash Table, Simulation",FALSE
Neighboring Bitwise XOR,neighboring-bitwise-xor,Medium,"Array, Bit Manipulation",FALSE
Maximum Number of Moves in a Grid,maximum-number-of-moves-in-a-grid,Medium,"Array, Dynamic Programming, Matrix",FALSE
Count the Number of Complete Components,count-the-number-of-complete-components,Medium,"Depth-First Search, Breadth-First Search, Union Find, Graph",FALSE
Extract Kth Character From The Rope Tree,extract-kth-character-from-the-rope-tree,Easy,"Tree, Depth-First Search, Binary Tree",TRUE
Minimum String Length After Removing Substrings,minimum-string-length-after-removing-substrings,Easy,"String, Stack, Simulation",FALSE
Lexicographically Smallest Palindrome,lexicographically-smallest-palindrome,Easy,"Two Pointers, String, Greedy",FALSE
Find the Punishment Number of an Integer,find-the-punishment-number-of-an-integer,Medium,"Math, Backtracking",FALSE
Modify Graph Edge Weights,modify-graph-edge-weights,Hard,"Graph, Heap (Priority Queue), Shortest Path",FALSE
Minimum Operations to Make Numbers Non-positive,minimum-operations-to-make-numbers-non-positive,Hard,"Array, Binary Search",TRUE
Buy Two Chocolates,buy-two-chocolates,Easy,"Array, Greedy, Sorting",FALSE
Extra Characters in a String,extra-characters-in-a-string,Medium,"Array, Hash Table, String, Dynamic Programming, Trie",FALSE
Maximum Strength of a Group,maximum-strength-of-a-group,Medium,"Array, Dynamic Programming, Backtracking, Greedy, Bit Manipulation, Sorting, Enumeration",FALSE
Greatest Common Divisor Traversal,greatest-common-divisor-traversal,Hard,"Array, Math, Union Find, Number Theory",FALSE
Remove Trailing Zeros From a String,remove-trailing-zeros-from-a-string,Easy,String,FALSE
Difference of Number of Distinct Values on Diagonals,difference-of-number-of-distinct-values-on-diagonals,Medium,"Array, Hash Table, Matrix",FALSE
Minimum Cost to Make All Characters Equal,minimum-cost-to-make-all-characters-equal,Medium,"String, Dynamic Programming, Greedy",FALSE
Maximum Strictly Increasing Cells in a Matrix,maximum-strictly-increasing-cells-in-a-matrix,Hard,"Array, Hash Table, Binary Search, Dynamic Programming, Memoization, Sorting, Matrix, Ordered Set",FALSE
Find Shortest Path with K Hops,find-shortest-path-with-k-hops,Hard,"Graph, Heap (Priority Queue), Shortest Path",TRUE
Minimize String Length,minimize-string-length,Easy,"Hash Table, String",FALSE
Semi-Ordered Permutation,semi-ordered-permutation,Easy,"Array, Simulation",FALSE
Sum of Matrix After Queries,sum-of-matrix-after-queries,Medium,"Array, Hash Table",FALSE
Count of Integers,count-of-integers,Hard,"Math, String, Dynamic Programming",FALSE
Count Houses in a Circular Street,count-houses-in-a-circular-street,Easy,"Array, Interactive",TRUE
Check if The Number is Fascinating,check-if-the-number-is-fascinating,Easy,"Hash Table, Math",FALSE
Find the Longest Semi-Repetitive Substring,find-the-longest-semi-repetitive-substring,Medium,"String, Sliding Window",FALSE
Movement of Robots,movement-of-robots,Medium,"Array, Brainteaser, Sorting, Prefix Sum",FALSE
Find a Good Subset of the Matrix,find-a-good-subset-of-the-matrix,Hard,"Array, Hash Table, Bit Manipulation, Matrix",FALSE
Neither Minimum nor Maximum,neither-minimum-nor-maximum,Easy,"Array, Sorting",FALSE
Lexicographically Smallest String After Substring Operation,lexicographically-smallest-string-after-substring-operation,Medium,"String, Greedy",FALSE
Collecting Chocolates,collecting-chocolates,Medium,"Array, Enumeration",FALSE
Maximum Sum Queries,maximum-sum-queries,Hard,"Array, Binary Search, Stack, Binary Indexed Tree, Segment Tree, Sorting, Monotonic Stack",FALSE
Find the Closest Marked Node,find-the-closest-marked-node,Medium,"Array, Graph, Heap (Priority Queue), Shortest Path",TRUE
Total Distance Traveled,total-distance-traveled,Easy,"Math, Simulation",FALSE
Find the Value of the Partition,find-the-value-of-the-partition,Medium,"Array, Sorting",FALSE
Special Permutations,special-permutations,Medium,"Array, Dynamic Programming, Bit Manipulation, Bitmask",FALSE
Painting the Walls,painting-the-walls,Hard,"Array, Dynamic Programming",FALSE
Count Substrings Without Repeating Character,count-substrings-without-repeating-character,Medium,"Hash Table, String, Sliding Window",TRUE
Find Maximum Number of String Pairs,find-maximum-number-of-string-pairs,Easy,"Array, Hash Table, String, Simulation",FALSE
Construct the Longest New String,construct-the-longest-new-string,Medium,"Math, Dynamic Programming, Greedy, Brainteaser",FALSE
Decremental String Concatenation,decremental-string-concatenation,Medium,"Array, String, Dynamic Programming",FALSE
Count Zero Request Servers,count-zero-request-servers,Medium,"Array, Hash Table, Sliding Window, Sorting",FALSE
Number of Beautiful Pairs,number-of-beautiful-pairs,Easy,"Array, Hash Table, Math, Counting, Number Theory",FALSE
Minimum Operations to Make the Integer Zero,minimum-operations-to-make-the-integer-zero,Medium,"Bit Manipulation, Brainteaser, Enumeration",FALSE
Ways to Split Array Into Good Subarrays,ways-to-split-array-into-good-subarrays,Medium,"Array, Math, Dynamic Programming",FALSE
Robot Collisions,robot-collisions,Hard,"Array, Stack, Sorting, Simulation",FALSE
Longest Even Odd Subarray With Threshold,longest-even-odd-subarray-with-threshold,Easy,"Array, Sliding Window",FALSE
Prime Pairs With Target Sum,prime-pairs-with-target-sum,Medium,"Array, Math, Enumeration, Number Theory",FALSE
Continuous Subarrays,continuous-subarrays,Medium,"Array, Queue, Sliding Window, Heap (Priority Queue), Ordered Set, Monotonic Queue",FALSE
Sum of Imbalance Numbers of All Subarrays,sum-of-imbalance-numbers-of-all-subarrays,Hard,"Array, Hash Table, Ordered Set",FALSE
Is Array a Preorder of Some Binary Tree,is-array-a-preorder-of-some-binary-tree,Medium,"Stack, Tree, Depth-First Search, Binary Tree",TRUE
Longest Alternating Subarray,longest-alternating-subarray,Easy,"Array, Enumeration",FALSE
Relocate Marbles,relocate-marbles,Medium,"Array, Hash Table, Sorting, Simulation",FALSE
Partition String Into Minimum Beautiful Substrings,partition-string-into-minimum-beautiful-substrings,Medium,"Hash Table, String, Dynamic Programming, Backtracking",FALSE
Number of Black Blocks,number-of-black-blocks,Medium,"Array, Hash Table, Enumeration",FALSE
Find the Maximum Achievable Number,find-the-maximum-achievable-number,Easy,Math,FALSE
Maximum Number of Jumps to Reach the Last Index,maximum-number-of-jumps-to-reach-the-last-index,Medium,"Array, Dynamic Programming",FALSE
Longest Non-decreasing Subarray From Two Arrays,longest-non-decreasing-subarray-from-two-arrays,Medium,"Array, Dynamic Programming",FALSE
Apply Operations to Make All Array Elements Equal to Zero,apply-operations-to-make-all-array-elements-equal-to-zero,Medium,"Array, Prefix Sum",FALSE
Height of Special Binary Tree,height-of-special-binary-tree,Medium,"Tree, Depth-First Search, Breadth-First Search, Binary Tree",TRUE
Sum of Squares of Special Elements ,sum-of-squares-of-special-elements,Easy,"Array, Enumeration",FALSE
Maximum Beauty of an Array After Applying Operation,maximum-beauty-of-an-array-after-applying-operation,Medium,"Array, Binary Search, Sliding Window, Sorting",FALSE
Minimum Index of a Valid Split,minimum-index-of-a-valid-split,Medium,"Array, Hash Table, Sorting",FALSE
Length of the Longest Valid Substring,length-of-the-longest-valid-substring,Hard,"Array, Hash Table, String, Sliding Window",FALSE
Number of Unique Categories,number-of-unique-categories,Medium,"Union Find, Interactive, Counting",TRUE
Check if Array is Good,check-if-array-is-good,Easy,"Array, Hash Table, Sorting",FALSE
Sort Vowels in a String,sort-vowels-in-a-string,Medium,"String, Sorting",FALSE
Visit Array Positions to Maximize Score,visit-array-positions-to-maximize-score,Medium,"Array, Dynamic Programming",FALSE
Ways to Express an Integer as Sum of Powers,ways-to-express-an-integer-as-sum-of-powers,Medium,Dynamic Programming,FALSE
Split Strings by Separator,split-strings-by-separator,Easy,"Array, String",FALSE
Largest Element in an Array after Merge Operations,largest-element-in-an-array-after-merge-operations,Medium,"Array, Greedy",FALSE
Maximum Number of Groups With Increasing Length,maximum-number-of-groups-with-increasing-length,Hard,"Array, Math, Binary Search, Greedy, Sorting",FALSE
Count Paths That Can Form a Palindrome in a Tree,count-paths-that-can-form-a-palindrome-in-a-tree,Hard,"Dynamic Programming, Bit Manipulation, Tree, Depth-First Search, Bitmask",FALSE
Count Nodes That Are Great Enough,count-nodes-that-are-great-enough,Hard,"Divide and Conquer, Tree, Depth-First Search, Binary Tree",TRUE
Number of Employees Who Met the Target,number-of-employees-who-met-the-target,Easy,Array,FALSE
Count Complete Subarrays in an Array,count-complete-subarrays-in-an-array,Medium,"Array, Hash Table, Sliding Window",FALSE
Shortest String That Contains Three Strings,shortest-string-that-contains-three-strings,Medium,"String, Greedy, Enumeration",FALSE
Count Stepping Numbers in Range,count-stepping-numbers-in-range,Hard,"String, Dynamic Programming",FALSE
Find The K-th Lucky Number,find-the-k-th-lucky-number,Medium,"Math, String, Bit Manipulation",TRUE
Account Balance After Rounded Purchase,account-balance-after-rounded-purchase,Easy,Math,FALSE
Insert Greatest Common Divisors in Linked List,insert-greatest-common-divisors-in-linked-list,Medium,"Linked List, Math, Number Theory",FALSE
Minimum Seconds to Equalize a Circular Array,minimum-seconds-to-equalize-a-circular-array,Medium,"Array, Hash Table",FALSE
Minimum Time to Make Array Sum At Most x,minimum-time-to-make-array-sum-at-most-x,Hard,"Array, Dynamic Programming, Sorting",FALSE
Faulty Keyboard,faulty-keyboard,Easy,"String, Simulation",FALSE
Check if it is Possible to Split Array,check-if-it-is-possible-to-split-array,Medium,"Array, Dynamic Programming, Greedy",FALSE
Find the Safest Path in a Grid,find-the-safest-path-in-a-grid,Medium,"Array, Binary Search, Breadth-First Search, Union Find, Heap (Priority Queue), Matrix",FALSE
Maximum Elegance of a K-Length Subsequence,maximum-elegance-of-a-k-length-subsequence,Hard,"Array, Hash Table, Stack, Greedy, Sorting, Heap (Priority Queue)",FALSE
Minimum Time Takes to Reach Destination Without Drowning,minimum-time-takes-to-reach-destination-without-drowning,Hard,"Array, Breadth-First Search, Matrix",TRUE
Max Pair Sum in an Array,max-pair-sum-in-an-array,Easy,"Array, Hash Table",FALSE
Double a Number Represented as a Linked List,double-a-number-represented-as-a-linked-list,Medium,"Linked List, Math, Stack",FALSE
Minimum Absolute Difference Between Elements With Constraint,minimum-absolute-difference-between-elements-with-constraint,Medium,"Array, Binary Search, Ordered Set",FALSE
Apply Operations to Maximize Score,apply-operations-to-maximize-score,Hard,"Array, Math, Stack, Greedy, Sorting, Monotonic Stack, Number Theory",FALSE
Minimum Relative Loss After Buying Chocolates,minimum-relative-loss-after-buying-chocolates,Hard,"Array, Binary Search, Sorting, Prefix Sum",TRUE
Count Pairs Whose Sum is Less than Target,count-pairs-whose-sum-is-less-than-target,Easy,"Array, Two Pointers, Binary Search, Sorting",FALSE
Make String a Subsequence Using Cyclic Increments,make-string-a-subsequence-using-cyclic-increments,Medium,"Two Pointers, String",FALSE
Sorting Three Groups,sorting-three-groups,Medium,"Array, Binary Search, Dynamic Programming",FALSE
Number of Beautiful Integers in the Range,number-of-beautiful-integers-in-the-range,Hard,"Math, Dynamic Programming",FALSE
Check if a String Is an Acronym of Words,check-if-a-string-is-an-acronym-of-words,Easy,"Array, String",FALSE
Determine the Minimum Sum of a k-avoiding Array,determine-the-minimum-sum-of-a-k-avoiding-array,Medium,"Math, Greedy",FALSE
Maximize the Profit as the Salesman,maximize-the-profit-as-the-salesman,Medium,"Array, Hash Table, Binary Search, Dynamic Programming, Sorting",FALSE
Find the Longest Equal Subarray,find-the-longest-equal-subarray,Medium,"Array, Hash Table, Binary Search, Sliding Window",FALSE
Maximal Range That Each Element Is Maximum in It,maximal-range-that-each-element-is-maximum-in-it,Medium,"Array, Stack, Monotonic Stack",TRUE
Furthest Point From Origin,furthest-point-from-origin,Easy,"String, Counting",FALSE
Find the Minimum Possible Sum of a Beautiful Array,find-the-minimum-possible-sum-of-a-beautiful-array,Medium,"Math, Greedy",FALSE
Minimum Operations to Form Subsequence With Target Sum,minimum-operations-to-form-subsequence-with-target-sum,Hard,"Array, Greedy, Bit Manipulation",FALSE
Maximize Value of Function in a Ball Passing Game,maximize-value-of-function-in-a-ball-passing-game,Hard,"Array, Dynamic Programming, Bit Manipulation",FALSE
Maximum Coins Heroes Can Collect,maximum-coins-heroes-can-collect,Medium,"Array, Two Pointers, Binary Search, Sorting, Prefix Sum",TRUE
Check if Strings Can be Made Equal With Operations I,check-if-strings-can-be-made-equal-with-operations-i,Easy,String,FALSE
Check if Strings Can be Made Equal With Operations II,check-if-strings-can-be-made-equal-with-operations-ii,Medium,"Hash Table, String, Sorting",FALSE
Maximum Sum of Almost Unique Subarray,maximum-sum-of-almost-unique-subarray,Medium,"Array, Hash Table, Sliding Window",FALSE
Count K-Subsequences of a String With Maximum Beauty,count-k-subsequences-of-a-string-with-maximum-beauty,Hard,"Hash Table, Math, String, Greedy, Combinatorics",FALSE
  Count Symmetric Integers,count-symmetric-integers,Easy,"Math, Enumeration",FALSE
Minimum Operations to Make a Special Number,minimum-operations-to-make-a-special-number,Medium,"Math, String, Greedy, Enumeration",FALSE
Count of Interesting Subarrays,count-of-interesting-subarrays,Medium,"Array, Hash Table, Prefix Sum",FALSE
Minimum Edge Weight Equilibrium Queries in a Tree,minimum-edge-weight-equilibrium-queries-in-a-tree,Hard,"Array, Tree, Graph, Strongly Connected Component",FALSE
Smallest Number With Given Digit Product,smallest-number-with-given-digit-product,Medium,"Math, Greedy",TRUE
Points That Intersect With Cars,points-that-intersect-with-cars,Easy,"Array, Hash Table, Prefix Sum",FALSE
Determine if a Cell Is Reachable at a Given Time,determine-if-a-cell-is-reachable-at-a-given-time,Medium,Math,FALSE
Minimum Moves to Spread Stones Over Grid,minimum-moves-to-spread-stones-over-grid,Medium,"Array, Dynamic Programming, Breadth-First Search, Matrix",FALSE
String Transformation,string-transformation,Hard,"Math, String, Dynamic Programming, String Matching",FALSE
Sum of Remoteness of All Cells,sum-of-remoteness-of-all-cells,Medium,"Array, Hash Table, Depth-First Search, Breadth-First Search, Union Find, Matrix",TRUE
Minimum Right Shifts to Sort the Array,minimum-right-shifts-to-sort-the-array,Easy,Array,FALSE
Minimum Array Length After Pair Removals,minimum-array-length-after-pair-removals,Medium,"Array, Hash Table, Two Pointers, Binary Search, Greedy, Counting",FALSE
